[{"provincia": "GUAYAS", "canton": "Milagro", "alimentador": "", "fecha": "2026-10-17", "dia": "Sábado", "horario": "03:00 a 06:00", "tipo_trabajo": "CAMBIO DE PARARRAYO SUBESTACIÓN", "zona_cortes": "", "sectores": "Cantón el Triunfo, Bucay, Cumanda, zonas urbanas y rurales.", "cantones": ["Milagro"], "distribuidora": "CNEL EP"}]