[{"provincia": "LOS RÍOS", "canton": "Ventanas - Quinsaloma", "alimentador": "", "fecha": "2026-10-22", "dia": "Jueves", "horario": "03:00 a 06:00", "tipo_trabajo": "CORRECCIÓN DE ANOMALÍAS TÉRMICAS EN SUBESTACIÓN LA ERCILIA READECUACIÓN DEL SISTEMA DE PROTECCIÓN DEL TRANSFORMADOR DE POTENCIA A NIVEL DE 69 KV.", "zona_cortes": "", "sectores": "Cantón Ventanas: Rctos. San Gerardo, Tarira, El Guineo, Calabí, Guineo de Adentro, Umbe, El Guabito, Vía E25 desde La Ercilia hasta el cruce de Mocache, con sus recintos cercanos, Agroleaginosas Los Ríos Oleorios; Flor de Los Ríos, Achotillo, Estero de Damas, Lechugalito, La Tragedia, Aguas Frías de Mocache, 4 Mangas, Zapotal Nuevo, Zapotal Viejo, Chacarita, Santa Rosa del Laurel, Barranco Colorado, Pasaje A y B, Estero Lindo, Aguacatal, Mina de Piedra, Sibimbe, Pepa de Oro y Los Amarillos. Cantón Quinsaloma: La Ercilia, Loma de Coco, El Paraíso, Vía Quinsaloma - Moraspungo, Estero de Piedra, San Miguel de Los Ríos, Balsería, La Fortuna, Las Palmas y todo el cantón Quinsaloma.", "cantones": ["Ventanas", "Quinsaloma"], "distribuidora": "CNEL EP"}]