[{"provincia": "MANABÍ", "canton": "Portoviejo", "alimentador": "", "fecha": "2026-10-22", "dia": "Jueves", "horario": "03:00 a 06:00", "tipo_trabajo": "CORRECCIÓN DE PUNTOS CALIENTES", "zona_cortes": "", "sectores": "Las parroquia Colón, Simón Bolívar, Francisco Pacheco; El Guabito, Los Ángeles, barrio Fátima, todos los Florones, vía a Pachinche, ciudadela Nuevo Portoviejo, ciudadela Los Helechos, ciudadela Rafael Correa, Los Geranios, sector 4 Esquinas, Estancia Vieja, Pachinche, Mapasingue y zonas aledañas.", "cantones": ["Portoviejo"], "distribuidora": "CNEL EP"}]