[{"provincia": "MORONA SANTIAGO", "canton": "SANTIAGO", "alimentador": "", "fecha": "2026-10-17", "dia": "Sábado", "horario": "03:00 a 06:00", "tipo_trabajo": "MANTENIMIENTO DE ESTRUCTURAS DE SOPORTE", "zona_cortes": "BELLA UNIÓN/CHINGANAZA/CAMBANACA", "sectores": "LA DELICIA, NUEVO TRIUNFO, PLAN GRANDE, AYANCAS", "cantones": ["Santiago"], "distribuidora": "Ministerio de Ambiente y Energía"}, {"provincia": "MORONA SANTIAGO", "canton": "SUCÚA", "alimentador": "", "fecha": "2026-10-17", "dia": "Sábado", "horario": "03:00 a 06:00", "tipo_trabajo": "CAMBIO DE SECCIONADORES Y DE PARARRAYOS", "zona_cortes": "SEIPA / EL TESORO", "sectores": "YUKUTEIS, SEIPA, CAYAMAS LOGROÑO", "cantones": ["Sucúa"], "distribuidora": "Ministerio de Ambiente y Energía"}, {"provincia": "MORONA SANTIAGO", "canton": "SUCÚA", "alimentador": "", "fecha": "2026-10-17", "dia": "Sábado", "horario": "05:00 a 06:00", "tipo_trabajo": "CAMBIO DE SECCIONADORES Y DE PARARRAYOS", "zona_cortes": "SEIPA / EL TESORO", "sectores": "YUKUTEIS, SEIPA, CAYAMAS LOGROÑO", "cantones": ["Sucúa"], "distribuidora": "Ministerio de Ambiente y Energía"}, {"provincia": "MORONA SANTIAGO", "canton": "SUCÚA Y LOGROÑO", "alimentador": "", "fecha": "2026-10-17", "dia": "Sábado", "horario": "03:00 a 06:00", "tipo_trabajo": "DE REDES HORARIO P", "zona_cortes": "RÍO BLANCO / SANTA MARIANITA / SUCÚA / HUAMBI / LOGROÑO / SHIMPIS", "sectores": "AMAZÓNICA HASTA EL RÍO SUNGAIME, BARRIO EL TERMINAL DESDE LA AV. TRONCAL AMAZONIA HASTA EL RÍO SUNGAIME, URBANIZACIÓN AMAZONAS, BARRIO LA CRUZ, BARRIO NORTE, BARRIO EL PARAÍSO, BARRIO EL PROGRESO, BARRIO CENTRO, BARRIO 8 DE DICIEMBRE, BARRIO 12 DE FEBRERO, BARRIO SUR, BARRIO AEROPUERTO, BARRIO 4 DE OCTUBRE, BARRIO LOS ARTESANOS, BARRIO EL NAZARENO, ARROQUIA LA ASUNCIÓN Y SUS COMUNIDADES, EL TRIUNFO, HUAMBINIMI, PARROQUIA HUAMBI Y SUS COMUNIDADES, LOGROÑO Y SUS COMUNIDADES, PARROQUIA SHIMPIS Y SUS COMUNIDADES.", "cantones": ["SUCÚA Y LOGROÑO"], "distribuidora": "Ministerio de Ambiente y Energía"}]