[{"provincia": "GUAYAS", "canton": "Guayaquil", "alimentador": "", "fecha": "2026-10-17", "dia": "Sábado", "horario": "03:00 a 06:00", "tipo_trabajo": "CORRECCIÓN DE PUNTOS CALIENTES CON REAJUSTE DE CONEXIONES", "zona_cortes": "", "sectores": "Edificio River Front 1, The Point, River Front 2, Edificio Santa Ana Loft y Edificio Bellini", "cantones": ["Guayaquil"], "distribuidora": "CNEL EP"}, {"provincia": "GUAYAS", "canton": "Guayaquil", "alimentador": "", "fecha": "2026-10-17", "dia": "Sábado", "horario": "03:00 a 06:00", "tipo_trabajo": "LIMPIEZA Y LAVADO EN EL POTRICO DE 69KV SUBESTACION PLAYAS.", "zona_cortes": "", "sectores": "Toda la parroquia Posorja", "cantones": ["Guayaquil"], "distribuidora": "CNEL EP"}, {"provincia": "GUAYAS", "canton": "Playas", "alimentador": "", "fecha": "2026-10-17", "dia": "Sábado", "horario": "03:00 a 06:00", "tipo_trabajo": "LIMPIEZA Y LAVADO EN EL POTRICO DE 69KV SUBESTACION POSORJA.", "zona_cortes": "", "sectores": "Todo el cantón Playas", "cantones": ["Playas"], "distribuidora": "CNEL EP"}]