[{"provincia": "LOS RÍOS", "canton": "Los Ríos", "alimentador": "", "fecha": "2026-10-17", "dia": "Sábado", "horario": "03:00 a 06:00", "tipo_trabajo": "CORRECCIÓN DE ANOMALÍAS TÉRMICAS", "zona_cortes": "", "sectores": "Cantones Babahoyo, Quinsaloma, Montalvo, Baba,Puebloviejo, Urdaneta, Ventanas, Vinces, Palenque de la provincia de Los Ríos y el Cantón Alfredo Baquerizo Moreno de la Provincia del Guayas junto con todos los sectores rurales, parroquias y recintos de los cantones mencionados.", "cantones": ["Los Ríos"], "distribuidora": "CNEL EP"}]