[{"provincia": "COTOPAXI", "canton": "La Maná", "alimentador": "", "fecha": "2026-10-17", "dia": "Sábado", "horario": "03:00 a 06:00", "tipo_trabajo": "Mantenimiento correctivo: cambio de seccionadores y terminales en el pórtico de salida del alimentador.", "zona_cortes": "Subestación La Maná", "sectores": "Chipehamburgo - La Maná Urbano - El Carmen", "cantones": ["La Maná"], "distribuidora": "Ministerio de Ambiente y Energía"}, {"provincia": "COTOPAXI", "canton": "La Maná", "alimentador": "", "fecha": "2026-10-17", "dia": "Sábado", "horario": "03:00 a 06:00", "tipo_trabajo": "Montaje e instalación de disyuntor tanque muerto 69KV Central Enermax.", "zona_cortes": "Subestación La Maná", "sectores": "Subestación La Maná, 4 alimentadores Empresa Eléctrica Provincial Cotopaxi S.A.", "cantones": ["La Maná"], "distribuidora": "Ministerio de Ambiente y Energía"}, {"provincia": "COTOPAXI", "canton": "Latacunga", "alimentador": "", "fecha": "2026-10-17", "dia": "Sábado", "horario": "03:00 a 06:00", "tipo_trabajo": "Mantenimiento correctivo: cambio de seccionadores y terminales en el pórtico de salida del alimentador.", "zona_cortes": "Subestación La Cocha", "sectores": "Latacunga Norte - Puente Aláquez La FAE - Aeropuerto", "cantones": ["Latacunga"], "distribuidora": "Ministerio de Ambiente y Energía"}]