[{"provincia": "GUAYAS", "canton": "Durán", "alimentador": "", "fecha": "2026-10-17", "dia": "Sábado", "horario": "03:00 a 06:00", "tipo_trabajo": "CAMBIO DE SECCIONADOR PORTAFUSIBLES CAMBIO O MANTENIMIENTO DE PUENTES (ESTRUCTURA DE RETENCIÓN", "zona_cortes": "", "sectores": "Sector 28 de Agosto y vía Durán Yaguachi", "cantones": ["Durán"], "distribuidora": "CNEL EP"}, {"provincia": "GUAYAS", "canton": "Guayas", "alimentador": "", "fecha": "2026-10-17", "dia": "Sábado", "horario": "03:00 a 06:00", "tipo_trabajo": "MANTENIMIENTO DE LA SUBESTACIÓN QUEVEDO DE CELEC", "zona_cortes": "", "sectores": "Cantón El Empalme y sus sectores aledaños.", "cantones": ["Guayas"], "distribuidora": "CNEL EP"}, {"provincia": "GUAYAS", "canton": "Samborondón", "alimentador": "", "fecha": "2026-10-17", "dia": "Sábado", "horario": "03:00 a 06:00", "tipo_trabajo": "• INSTALACION DE HILO DE GUARDA DE LT3 • MANTENIMIENTO DE LA SUBESTACIÓN LOS ARCOS. • CAMBIO DE ESTRUCTURAS • CAMBIO DE REDES", "zona_cortes": "", "sectores": "URB. BOSQUES DE CASTILLA, URB VISTA AL RIO, URB PLAZA REAL, PARQUE HISTORICOS, URB ENTRERIOS (RESIDENCIAS Y CONDOMINIOS), CENTRO COMERCIAL LAS TERRAZAS, TEATRO SANCHEZ AGUILAR, CONDOMINIO ESMERALDA, SAMBORONDON BUSINESS CENTER SBC, OFICCE BUSINESS CENTER OFC, FOOD GARDEN, BANCO BOLIVARIANO, BANCO PACIFICO, MIDTOWN, BOCCA, LA TORRE, LOCALES COMERCIALES IGLESIA SANTA TERESITA, VIVERO SUNDARAM JARDINES, LOCAL COMERCIAL PRISMA, ANTENA DE CNT, HOTEL EL PARQUE, XIMA, ARCOSPLAZA 1 Y 2, VILLAGE, DEL PORTAL, CC ALHAMBRA, UEES, CC RIOCENTRO ENTRERIOS, COLEGIO NUEVO MUNDO, URB SANTA FE, URB PUERTA AL RIO, URB ARRAYANES, URB RIO SOL TOWERS, URB SAN BERNARDO 1, 2 Y 3, URB BALEAREA, URB ENTREOLIVOS, URB RIVERSIDE, URB VILLAREAL, URB IBIZA, URB TORNERO,URB SAN JOSE, URB SANTA MARIA I, URB TERRANOVA, CALLE CELESTE BLACIO, CALLE SANTA MARIA, URB ANAHI, URB VILLA DEL SOL, URB LAS CONDES, URB VERONA I, URB TRIANA, URB BOUGANVILLE, CLUB DIANA QUINTANA, URB SANTA LUCIA, URB ACROPOLIS, LOS PORTONES, INTEGRAL, CONDOMINIO LOS CEDROS. (Del Km 1 al Km 3 de la vía Samborondón, parroquia La Puntilla) TODAS LAS URBANIZACIONES Y CARGAS COMERCIALES DEL CONJUNTO HABITACIONAL CIUDAD CELESTE", "cantones": ["Samborondón"], "distribuidora": "CNEL EP"}, {"provincia": "LOS RÍOS", "canton": "Los Ríos", "alimentador": "", "fecha": "2026-10-17", "dia": "Sábado", "horario": "03:00 a 06:00", "tipo_trabajo": "MANTENIMIENTO DE LA SUBESTACIÓN QUEVEDO DE CELEC", "zona_cortes": "", "sectores": "Cantones Quevedo, Valencia, Buena Fe, Mocache.", "cantones": ["Los Ríos"], "distribuidora": "CNEL EP"}, {"provincia": "MANABI", "canton": "Manabi", "alimentador": "", "fecha": "2026-10-17", "dia": "Sábado", "horario": "03:00 a 06:00", "tipo_trabajo": "MANTENIMIENTO DE LA SUBESTACIÓN QUEVEDO DE CELEC", "zona_cortes": "", "sectores": "Cantón Pichincha y sus sectores aledaños.", "cantones": ["Manabi"], "distribuidora": "CNEL EP"}]