[{"provincia": "MANABÍ", "canton": "Manta", "alimentador": "", "fecha": "2026-10-17", "dia": "Sábado", "horario": "03:00 a 06:00", "tipo_trabajo": "INSTALACIÓN DE NUEVAS ESTRUCTURAS", "zona_cortes": "", "sectores": "Barrio la Ensenadita, edificio CNEL, Centro de Manta, Municipio Zona Bancaria, Barrio Jocay Barrio La Victoria, Industrias ALES, Barrio San José, Cementerio de Tarqui, Av. 108, Urbanización MARATEA, Barrio Bellavista #1, Av. 26 desde la calle 7 hasta la calle 20., Barrio La Dolorosa, Barrio Santa Fe, Barrio Santa Mónica, Barrio Los Algarrobos, Colegio Técnico, Parte de la Cdla. Universitaria., Gasolinera Caballo de Troya, Barrio Buenavista.", "cantones": ["Manta"], "distribuidora": "CNEL EP"}, {"provincia": "MANABÍ", "canton": "Portoviejo TRABAJOS EN LÍNEAS DE SUBTRANSMISIÓN", "alimentador": "", "fecha": "2026-10-17", "dia": "Sábado", "horario": "03:00 a 06:00", "tipo_trabajo": "", "zona_cortes": "", "sectores": "Av Universitaria, Barrio San Pablo, Cdl El Maestro, Av Reales Tamarindo, Parque Forestal, Vía al Corozo, Cdl Municpal, Solca, Cdl San Marcos, Vía a Crucita hasta el Tomate, Milagro de Río Chico, Cdl Universitari, Parque la Rotonda, UTM, Cdl San José.", "cantones": ["Portoviejo TRABAJOS EN LÍNEAS DE SUBTRANSMISIÓN"], "distribuidora": "CNEL EP"}]