[{"provincia": "AZUAY", "canton": "Ponce Enríquez", "alimentador": "", "fecha": "2026-10-17", "dia": "Sábado", "horario": "03:00 a 06:00", "tipo_trabajo": "CORRECCIÓN DE PUNTOS CALIENTES CON REAJUSTE DE CONEXIONES", "zona_cortes": "", "sectores": "Todo el cantón Ponce Enríquez.", "cantones": ["Camilo Ponce Enríquez"], "distribuidora": "CNEL EP"}, {"provincia": "EL ORO", "canton": "El Guabo", "alimentador": "", "fecha": "2026-10-17", "dia": "Sábado", "horario": "03:00 a 06:00", "tipo_trabajo": "CORRECCIÓN DE PUNTOS CALIENTES CON REAJUSTE DE CONEXIONES", "zona_cortes": "", "sectores": "Todo el cantón El Guabo", "cantones": ["El Guabo"], "distribuidora": "CNEL EP"}, {"provincia": "EL ORO", "canton": "Machala", "alimentador": "", "fecha": "2026-10-17", "dia": "Sábado", "horario": "03:00 a 06:00", "tipo_trabajo": "CORRECCIÓN DE PUNTOS CALIENTES CON REAJUSTE DE CONEXIONES", "zona_cortes": "", "sectores": "Todo el cantón Machala.", "cantones": ["Machala"], "distribuidora": "CNEL EP"}, {"provincia": "EL ORO", "canton": "Pasaje", "alimentador": "", "fecha": "2026-10-17", "dia": "Sábado", "horario": "03:00 a 06:00", "tipo_trabajo": "CORRECCIÓN DE PUNTOS CALIENTES CON REAJUSTE DE CONEXIONES", "zona_cortes": "", "sectores": "Línea de subtransmisión Peaña – La Iberia", "cantones": ["Pasaje"], "distribuidora": "CNEL EP"}, {"provincia": "GUAYAS", "canton": "Balao", "alimentador": "", "fecha": "2026-10-17", "dia": "Sábado", "horario": "03:00 a 06:00", "tipo_trabajo": "CORRECCIÓN DE PUNTOS CALIENTES CON REAJUSTE DE CONEXIONES", "zona_cortes": "", "sectores": "Todo el cantón Balao.", "cantones": ["Balao"], "distribuidora": "CNEL EP"}]