[{"provincia": "ESMERALDAS", "canton": "Esmeraldas", "alimentador": "", "fecha": "2026-10-17", "dia": "Sábado", "horario": "03:00 a 06:00", "tipo_trabajo": "Reajuste de elementos, limpieza de aislamiento y cambio de seccionadores en alimentadores de la subestación Las Palmas.", "zona_cortes": "", "sectores": "Norte de la ciudad de Esmeraldas: ECU 911, Tercer Piso, Miramar, El Panecillo, El Regocijo, Mina de Piedra, El Faro, todo el sector de Las Palmas, avenida del Pacífico, canal Telecosta, Hospital Naval, COOPNO, Distrito de Esmeraldas del Servicio Nacional de Aduana, Puerto Pesquero Artesanal, avenida Libertad desde la calle Jr Coronel hasta la calle Lavallen, calle Sucre desde la Jr. Coronel hasta la calle Eugenio Espejo, CNT, Unidad Educativa Liceo Naval, Ciudadela Naval y centro comercial Multiplaza.", "cantones": ["Esmeraldas"], "distribuidora": "CNEL EP"}]