[{"provincia": "PICHINCHA", "canton": "Quito", "alimentador": "", "fecha": "2026-10-17", "dia": "Sábado", "horario": "03:00 a 06:00", "tipo_trabajo": "MANTENIMIENTO PERIÓDICO", "zona_cortes": "SANGOLQUÍ", "sectores": "VÍA AMAGUAÑA, SAN JUAN, SAN LUIS", "cantones": ["Quito"], "distribuidora": "Ministerio de Ambiente y Energía"}, {"provincia": "PICHINCHA", "canton": "Quito", "alimentador": "", "fecha": "2026-10-17", "dia": "Sábado", "horario": "03:00 a 06:00", "tipo_trabajo": "MANTENIMIENTO EMERGENTE", "zona_cortes": "TUMBACO", "sectores": "TUMBACO, EL CHICHE - AV. OSWALDO GUAYASAMÍN", "cantones": ["Quito"], "distribuidora": "Ministerio de Ambiente y Energía"}]