[{"provincia": "NAPO", "canton": "ARCHIDONA", "alimentador": "", "fecha": "2026-10-17", "dia": "Sábado", "horario": "03:00 a 06:00", "tipo_trabajo": "DE AISLADORES EN ESTADO, REEMPLAZO DE EN MAL ESTADO", "zona_cortes": "CANTÓN ARCHIDONA/PARROQUIA ARCHIDONA/HATUN SUMACO-COTUNDO", "sectores": "REEMPLAZO MARGEN IZQUIERDO DE LA VÍA TENA ARCHIDONA MAL DESDE EL CHIMBADERO, BARRIO SAN JACINTO, SECCIONADOR CHAUPISHUNGO, INCHILLAQUI, CÓNDOR MIRADOR, AYAPATA, AGUA MARINA, LA LIBERTAD, SAN AGUSTÍN, ANDALUCIA. SECTORES OESTE DE ARCHIDONA, SINCHI SACHA, CIRCUNVALACIÓN, MARGEN IZQUIERDO DE LA AVENIDA NAPO, PIEDRA GRANDE, CAPOA, , SAN VICENTE, SHICAMA, SANTA RITA, MANDURO, SAN MARCOS, BATANCOCHA, YAHUARI, RUMIPAMBA, RETEN, LA TOTALIDAD DE LAS PARROQUIAS COTUNDO, HATUN SUMACO Y SAN PABLO DE USHPAYACU, ATACAPI, PLANTA DE AGUA POTABLE COLONSO DEL GAD MUNICIPAL DE TENA, UNIVERSIDAD IKIAM", "cantones": ["ARCHIDONA"], "distribuidora": "Ministerio de Ambiente y Energía"}, {"provincia": "NAPO", "canton": "TENA", "alimentador": "", "fecha": "2026-10-17", "dia": "Sábado", "horario": "03:00 a 06:00", "tipo_trabajo": "REEMPLAZO DE CONDUCTOR Y ESTRUCTURAS", "zona_cortes": "CANTÓN TENA-PARROQUIA TENA", "sectores": "BARRIOS: PLAN DE SALUD, ELOY ALFARO, SAN JORGE, LAS GUAYUSAS, PALANDACOCHA, GIL RAMÍREZ DÁVALOS, EL PARAÍSO, SAN LUCAS, HUERTOS FAMILIARES 2, SAN PEDRO DE APAYACU, LAS MALVINAS, GUINEA CHIMBANA, LA TOTALIDAD DE LAS PARROQUIAS PANO Y TALAG.", "cantones": ["TENA"], "distribuidora": "Ministerio de Ambiente y Energía"}, {"provincia": "NAPO", "canton": "TENA", "alimentador": "", "fecha": "2026-10-17", "dia": "Sábado", "horario": "03:00 a 06:00", "tipo_trabajo": "REEMPLAZO DE SECCIONADORES Y TRANSFORMADOR", "zona_cortes": "CANTÓN TENA-PARROQUIA TENA", "sectores": "MARGEN DERECHO DE LA VÍA TENA - ARCHIDONA SECTORES 21 DE ENERO, AVATE, SANTA INES MARGEN IZQUIERDO, SECAP, LOS PINOS, AGENCIA NACIONAL DE TRÁNSITO, UGLOPAMBA, SAN LUIS ALTO, DOS RÍOS, TERERE, EL DORADO, PAUSHIYACU BAJO, BELLAVISTA ALTA Y BAJA.", "cantones": ["TENA"], "distribuidora": "Ministerio de Ambiente y Energía"}, {"provincia": "TUNGURAHUA", "canton": "PELILEO", "alimentador": "", "fecha": "2026-10-17", "dia": "Sábado", "horario": "03:00 a 06:00", "tipo_trabajo": "REEMPLAZO POSTE EN MAL ESTADO", "zona_cortes": "CANTÓN PELILEO", "sectores": "REDONDEL DE LA HUAMBALEÑA", "cantones": ["PELILEO"], "distribuidora": "Ministerio de Ambiente y Energía"}, {"provincia": "TUNGURAHUA", "canton": "PELILEO", "alimentador": "", "fecha": "2026-10-17", "dia": "Sábado", "horario": "03:00 a 06:00", "tipo_trabajo": "REEMPLAZO POSTE EN MAL ESTADO", "zona_cortes": "CANTÓN PELILEO", "sectores": "CALLE PUERTA DEL DORADO VÍA A OLMEDO", "cantones": ["PELILEO"], "distribuidora": "Ministerio de Ambiente y Energía"}, {"provincia": "TUNGURAHUA", "canton": "PELILEO-PATATE", "alimentador": "", "fecha": "2026-10-17", "dia": "Sábado", "horario": "03:00 a 06:00", "tipo_trabajo": "CORRECCIÓN DE PUNTOS CALIENTES EN BARRAS 69 Y 13.8 KV DE LA SUBESTACIÓN PELILEO, ACORDE A INFORME DE TERMOGRAFÍA", "zona_cortes": "CANTONES PELILEO Y PATATE", "sectores": "AV. CONFRATERNIDAD, AV. JORGE CHACÓN, EL TAMBO. PARROQUIAS: GARCIA MORENO, PELILEO GRANDE, HUAMBALÓ, COTALÓ, BOLÍVAR DEL CANTÓN PELILEO, Y EL CANTÓN PATATE.", "cantones": ["PELILEO", "PATATE"], "distribuidora": "Ministerio de Ambiente y Energía"}]