[{"provincia": "LOJA", "canton": "Celica", "alimentador": "", "fecha": "2026-10-17", "dia": "Sábado", "horario": "03:00 a 06:00", "tipo_trabajo": "MANTENIMIENTO PREVENTIVO POREL FENÓMENO DEL NIÑO 2026", "zona_cortes": "CELICA", "sectores": "CANTÓN CELICA Sábado, 17 de octubre de", "cantones": ["Celica"], "distribuidora": "Ministerio de Ambiente y Energía"}, {"provincia": "LOJA", "canton": "PINDAL / PUYANGO", "alimentador": "", "fecha": "2026-10-17", "dia": "Sábado", "horario": "03:00 a 06:00", "tipo_trabajo": "MANTENIMIENTO PREVENTIVO POR EL FENÓMENO DEL NIÑO", "zona_cortes": "PINDAL / PUYANGO", "sectores": "CANTONES: PINDAL / PUYANGO / ZAPOTILLO", "cantones": ["PINDAL", "PUYANGO"], "distribuidora": "Ministerio de Ambiente y Energía"}, {"provincia": "ZAMORA CHINCHIPE", "canton": "Yantzaza", "alimentador": "", "fecha": "2026-10-17", "dia": "Sábado", "horario": "03:00 a 06:00", "tipo_trabajo": "MANTENIMIENTO EMERGENTE 7 DE OPERACIÓN 2026", "zona_cortes": "YANTZAZA ZAMORA CHINCHIPE", "sectores": "SECTOR NORTE DEL ÁREA URBANA DE LA CIUDAD DE VANTZAZA Sábado, 17 de octubre de", "cantones": ["Yantzaza"], "distribuidora": "Ministerio de Ambiente y Energía"}, {"provincia": "ZAMORA CHINCHIPE", "canton": "Yantzaza / Paquisha", "alimentador": "", "fecha": "2026-10-17", "dia": "Sábado", "horario": "03:00 a 06:00", "tipo_trabajo": "MANTENIMIENTO EMERGENTE DE OPERACIÓN AA", "zona_cortes": "YANTZAZA / PAQUISHA", "sectores": "PARROQUIA LOS ENCUENTROS Y CHICAÑA DEL CANTÓN YANTZAZA / PARROQUIA BELLAVISTA DEL CANTÓN PAQUISHA", "cantones": ["Yantzaza", "Paquisha"], "distribuidora": "Ministerio de Ambiente y Energía"}, {"provincia": "ZAMORA CHINCHIPE", "canton": "Zamora", "alimentador": "", "fecha": "2026-10-17", "dia": "Sábado", "horario": "03:00 a 06:00", "tipo_trabajo": "MANTENIMIENTO EMERGENTE DE OPERACIÓN 2026", "zona_cortes": "ZAMORA ZAMORA CHINCHIPE", "sectores": "PARROQUIA SABANILLA / EL LIMÓN Y ÁREA URBANA DE LA CIUDAD DE ZAMORA Sábado, 17 de octubre de", "cantones": ["Zamora"], "distribuidora": "Ministerio de Ambiente y Energía"}, {"provincia": "ZAMORA CHINCHIPE", "canton": "Zamora", "alimentador": "", "fecha": "2026-10-17", "dia": "Sábado", "horario": "03:00 a 06:00", "tipo_trabajo": "MANTENIMIENTO OPERACIÓN EMERGENTE DE 2026", "zona_cortes": "ZAMORA", "sectores": "/ PARROQUIA CUMBARATZA TIMBARA Y ÁREA URBANA DE LA CIUDAD DE ZAMORA Sábado, 17 de octubre de", "cantones": ["Zamora"], "distribuidora": "Ministerio de Ambiente y Energía"}]